# id	sub	tier	score	bounty	ncom	ageH	op_since	op_nitems	hits	tags	title
1520461	Stacker_Stocks	2	1177	0	1	1.2	724606	11208	recent@econ|top@econ|recent@Stacker_Stocks	FRESH,HOT,SIGNAL	Strategy's Broken Math and Accounting 101 (WSJ, Jonathan Weil)
1520439	bitdevs	1	1150	0	9	2.2	223678	5760	recent@bitdevs|top@bitdevs	HOT,SIGNAL	Thinking about building a new Bitcoin node client in nodejs
1520169	bitcoin	1	745	0	10	10.4	1520158	6	recent@bitcoin|top@bitcoin|recent@bitdevs	SIGNAL	Why isn't more of the BTC space using Elixir/OTP?
1520358	bitcoin	1	695	0	3	4.0	74100	11033	recent@bitcoin|top@bitcoin	SIGNAL	Ledger announces support for two NIST post quantum standards
1520250	Stacker_Stocks	2	654	0	8	6.5	402772	22146	recent@Stacker_Stocks|top@Stacker_Stocks	SIGNAL,SELF_POST_OPP	Strategy Sells 3,588 BTC to Fund Digital Credit Dividends; Now Holds ₿843,775
1520341	Design	2	464	0	0	4.2	383547	3308	recent@Design|top@Design	SIGNAL	Greyscaler
1520191	news	2	460	0	1	9.9	51481	4078	recent@news|top@news	SIGNAL	China test fires submarine launched missile into Pacific
1520262	history	2	436	0	0	6.1	1512518	49	recent@history|top@history	SIGNAL	Daily Bitcoin Lore (16 years ago): Bitcoin v0.3 Released
1520223	news	2	402	0	2	7.8	51481	4078	recent@Stacker_Stocks|top@Stacker_Stocks|recent@news	SIGNAL	Strategy company sold 3,588 bitcoin last week to replenish its dollar reserves
1520265	bitcoin	1	363	0	0	5.9	74100	11033	recent@bitcoin|top@bitcoin	SIGNAL	pricenode-attestation: Attestation for Bisq pricenode data - BcnBitcoinOnly
1520429	history	2	311	0	0	2.4	1512518	49	recent@history|top@history	SIGNAL	Daily Bitcoin Lore (10 years ago): Buenos Aires Blocked Uber. Bitcoin Helped.
1520296	bitcoin	1	310	0	5	5.1	74100	11033	recent@bitcoin|top@bitcoin|recent@lightning	SIGNAL	Trustless: "Non custodial" Bitcoin-only mobile wallet.
1520364	nostr	1	309	0	2	3.9	1510840	4	recent@nostr|top@nostr	SIGNAL	swift-nostr v0.6.0: NIP-46 remote signing — no nsec in your app
1520240	Politics_And_Law	3	279	0	4	7.0	401865	8225	recent@Stacker_Stocks|top@Stacker_Stocks	SIGNAL	President Trump to Ring the NYSE and NASDAQ Opening Bell From Oval Office Today
1520217	BooksAndArticles	2	263	0	4	8.0	9274	24393	recent@history|top@history|recent@BooksAndArticles	SIGNAL	Marcus Aurelius Meditations: An audiobook note taking thread
1520403	bitcoin	1	250	0	2	3.2	296825	4772	recent@bitcoin|top@bitcoin|recent@bitcoin_beginners	SIGNAL	Hope With Bitcoin,
1520293	Memes	2	202	0	7	5.2	36151	1542	recent@Memes|top@Memes	SIGNAL,SELF_POST_OPP	Meme Monday - Top Meme Goes in the Newsletter
1520241	lightning	1	123	0	1	6.9	440729	184	recent@lightning|top@lightning	SIGNAL	Biggest Channel Opened Today (5.0 BTC) + New Node Spotlight (03886889de219866e…)
1519910	bitcoin	1	2712	0	7	26.5	178	913	recent@bitcoin	HOT	Sunday Survey: Do you think there was affirmative action/DEI in Bitcoin Core?
1520006	Politics_And_Law	3	1408	0	6	21.5	88718	45067	recent@history|top@history	HOT,SELF_POST_OPP	How I Busted the Ruby Ridge Coverup | The Libertarian Institute
1519963	bitcoin	1	1290	0	21	23.4	463	722	recent@bitcoin|top@bitcoin	HOT	Anyone got plans to dump ecash fork? Replay Attacks etc
1519779	tech	1	1138	0	1	34.6	7271	764	recent@tech	HOT	Researchers Create Self-Replicating Seedbox in Quest for Decentralized Democracy
1519962	security	1	1057	0	1	23.4	1507914	8	recent@security|top@security	HOT	Pegasus used against EU Pegasus investigator, bold move...
1519858	bitcoin	1	989	0	7	28.9	223678	5760	recent@bitcoin		Convince my family to accept bitcoin
1519979	DIY	3	819	0	0	22.3	280679	22369	recent@tech|top@tech		The Future of Flipper Zero Development
1520129	lightning	1	818	0	1	14.7	263526	452	recent@lightning|top@lightning		Bull Wallet Experience?
1519873	charts_and_maps	2	724	0	9	28.6	402772	22146	recent@charts_and_maps	SELF_POST_OPP	Americans of all ages are spending less time socializing
1519774	AI	1	672	0	3	35.5	1519770	3	recent@privacy|recent@devs|recent@AI		Anonymous open-source LLM proxy to access frontier and open weight models w/ API
1519972	math	2	646	0	0	22.7	280679	22368	recent@bitcoin|top@bitcoin|recent@bitdevs		Btc-verified: formalizing the Bitcoin protocol
1519941	AI	1	562	0	2	25.4	12309	3572	recent@AI|recent@econ		The Generational Force Hollowing Out the Economy
1519896	history	2	502	0	1	27.2	1512518	49	recent@history		Daily Bitcoin Lore (2 years ago): The Law That Made Germany Sell 50,000 Bitcoin
1519831	math	2	376	0	0	30.0	9274	24393	recent@math		Magic Internet Math Website Launch
1519966	history	2	371	0	1	23.2	1512518	49	recent@history|top@history		Daily Bitcoin Lore (15 years ago): The Bitcoin DEX That Arrived Before Its Time
1519890	bitcoin	1	370	0	1	27.6	934367	921	recent@bitcoin		Making JoinMarket makers harder to follow
1520051	AI	1	368	0	1	21.0	1293586	1996	recent@tech|top@tech|recent@AI		Major Union Livid After 1,000 Factory Workers Were Replaced With 50 Robots
1519882	history	2	363	0	3	28.1	1512518	49	recent@history		Daily Bitcoin Lore (9 years ago): AlphaBay Seized and the Exit Was a Trap
1519978	history	2	363	0	2	22.4	1512518	49	recent@history|top@history		Daily Bitcoin Lore (3 years ago): Larry Fink's Six-Year Bitcoin Flip
1519845	bitdevs	1	281	0	6	29.2	1519718	9	recent@bitdevs		How do add up my spendable wallet here?
1519819	lightning	1	273	0	1	30.9	440729	184	recent@lightning		Biggest Channel Opened Today (5.0 BTC) + New Node Spotlight (03fb9b70c1dd4d409…)
1519832	Design	2	261	0	0	30.0	383547	3308	recent@Design		The organizational cost of low taste
1519982	Stacker_Stocks	2	250	0	17	22.2	9274	24393	recent@Stacker_Stocks|top@Stacker_Stocks	SELF_POST_OPP	Blok Whatcha Buying ? Week #45
1519993	Politics_And_Law	3	201	0	1	22.1	280679	22369	recent@econ|top@econ|recent@Stacker_Stocks		The American Century (?)
1519790	meta	1	191	0	2	34.2	36151	1542	recent@meta		This Day on SN: July 5
1519976	lol	2	184	0	2	22.5	280679	22369	recent@lol|top@lol		Trump memecoin investors lost $3.8 billion, analysis finds
1519813	podcasts	2	117	0	0	31.5	1227948	191	recent@bitcoin_beginners|recent@podcasts		YATA EPISODE #13
1519807	Stacker_Stocks	2	100	0	2	31.6	9274	24393	recent@Stacker_Stocks		Daily Stock Discussion ~Stacker_Stocks
1519805	Design	2	77	0	0	31.6	383547	3308	recent@Design		How to design arrows
1520247	bitcoin_beginners	1	57	0	0	6.6	296825	4772	recent@bitcoin_beginners|top@bitcoin_beginners|recent@bitdevs		Nutshell Release 0.20.2: Mostly a hardening release for the mint and wallet.
1520150	bitcoin	1	57	0	0	13.2	296825	4772	recent@bitcoin_beginners|top@bitcoin_beginners|recent@bitdevs		Introduction To Bitcoin
1520125	bitcoin_beginners	1	46	0	0	16.1	296825	4772	recent@bitcoin_beginners|top@bitcoin_beginners|recent@bitdevs		Deep Dive: Zeus Lightning Wallet Infrastructure
1520176	Stacker_Stocks	2	42	0	13	10.2	9274	24393	recent@Stacker_Stocks|top@Stacker_Stocks		Daily Stock Discussion ~Stacker_Stocks
1519909	bitcoin	1	36	0	0	26.5	296825	4772	recent@bitcoin_beginners|recent@bitdevs|recent@lightning		Is Bitcoin the Answer to Malawi's Problem? | She Coder
1520243	security	1	21	0	0	6.9	297791	7607	recent@security|top@security		Google Disrupts NetNut Residential Proxy Network Spanning 2 Million Home Devices
1519872	science	2	21	0	0	28.6	1045996	67	recent@science		Intelligence Capital Index
1520277	Design	2	21	0	0	5.5	383547	3308	recent@Design|top@Design		Understanding is the new bottleneck
1520470	security	1	0	0	0	0.9	297791	7607	recent@security|top@security	FRESH	Confidential computing's core trust mechanism is broken. The fix may not exist
1520483	tech	1	0	0	0	0.0	1293586	1996	recent@Construction_and_Engineering|top@Construction_and_Engineering	FRESH	US home battery installations hit record high on rising electricity costs
1520318	Politics_And_Law	3	0	0	0	4.6	1200576	1306	recent@ideasfromtheedge|top@ideasfromtheedge		There is Nothing But a Ruling Class -  A Free Country? Larken Rose
1519974	news	2	0	0	0	22.6	297791	7607	recent@news|top@news		EasyJet reaches 'agreement in principle' over takeover bid
1519776	lol	2	0	0	0	35.4	1278026	618	recent@lol		Can someone have a quick peruse over this qword salad lol
