# id	sub	tier	score	bounty	ncom	ageH	op_since	op_nitems	hits	tags	title
1518188	DIY	3	10219	0	12	5.7	719829	298	recent@devs|top@devs	HOT,SIGNAL,SELF_POST_OPP	Plunda.co has a new home!
1518130	bitcoin	1	2831	0	1	11.2	593189	831	recent@bitcoin|top@bitcoin	HOT,SIGNAL	Money Laundering Index (Orlin Grabbe archive, 1990s cypherpunk)
1518135	bitcoin	1	2574	0	3	10.8	190751	46	recent@bitcoin|top@bitcoin	HOT,SIGNAL	NO CONSENSUS FOR CONSENSUS CLEANUP
1518216	Stacker_Sports	3	1002	0	3	4.1	724606	11095	recent@econ|top@econ	HOT,SIGNAL	Prediction Markets Are How We Know What We Know (Bloomberg, Christopher Beam)
1518162	charts_and_maps	2	826	0	3	8.0	241	2833	recent@Stacker_Stocks|top@Stacker_Stocks|recent@charts_and_maps	SIGNAL	Trump outearned every publicly traded crypto firm in 2025
1518186	AI	1	491	0	1	5.7	297791	7603	recent@AI|top@AI	SIGNAL	OpenAI proposes 5% stake to Trump administration to ease Washington pressure
1518171	Politics_And_Law	3	391	0	0	6.8	147412	1418	recent@history|top@history	SIGNAL	The Benefits for maintaining the Business of Continuous Wars
1518157	bitcoin_beginners	1	240	0	1	8.5	296825	4747	recent@bitcoin_beginners|top@bitcoin_beginners|recent@bitdevs	SIGNAL	On Bridging The Gap Between Devs And Users
1518282	history	2	240	0	0	0.9	1512518	34	recent@history|top@history	FRESH,SIGNAL	Daily Bitcoin Lore (8 years ago): Voorhees Defeats Schiff at the Soho Forum
1518189	lightning	1	233	0	0	5.6	163128	3633	recent@lightning|top@lightning	SIGNAL	BareBits/electrum_clink: A CLINK/noffer plugin for electrum
1518271	Design	2	204	0	0	1.2	383547	3285	recent@Design|top@Design	FRESH,SIGNAL	On the semantic web
1518241	Stacker_Stocks	2	135	0	3	2.1	38951	2222	recent@Stacker_Stocks|top@Stacker_Stocks	SIGNAL	Trump is the most openly corrupt politician in history
1517846	bitcoin	1	4700	0	2	21.8	1014665	198	recent@bitcoin|top@bitcoin	HOT	LND DoS bug, libevent removal, Q&A - Bitcoin Optech Newsletter #411 Podcast
1517707	econ	2	2393	0	26	25.9	88718	44922	recent@econ	HOT	Top June ~Econ Posts
1517667	Stacker_Stocks	2	2058	0	6	28.2	724606	11095	recent@econ|recent@Stacker_Stocks	HOT,SELF_POST_OPP	The Bitcoin Bank Run on Strategy and STRC (Money Stuff, Matt Levine)
1517824	bitcoin	1	1639	0	6	22.7	1242375	100	recent@bitcoin|top@bitcoin	HOT	What would you put in your genesis block?
1517897	bitcoin	1	1584	0	14	19.7	74100	10961	recent@bitcoin|top@bitcoin|recent@econ	HOT	Bitcoin Is Not Freedom: The Delusion of Digital Escape - Mises Institute
1517660	econ	2	1581	0	3	28.4	724606	11095	recent@econ	HOT	Strategy and the Death of the Bitcoin Treasury Company (Barron's, Tatananni)
1517976	AI	1	1539	0	2	17.8	724606	11095	recent@AI|top@AI|recent@econ	HOT	Let AI Generate Your World Cup Predictions (FT, Louis Ashworth)
1518020	bitcoin	1	1502	0	13	17.0	223678	5745	recent@bitcoin|top@bitcoin|recent@mempool	HOT	Nice watch-only bitcoin wallet
1517738	bitcoin	1	1346	0	10	25.0	74100	10961	recent@bitcoin|recent@history	HOT	Reflections Upon Bitcoin's Block Size Debate
1518114	lightning	1	1205	0	7	12.3	223678	5745	recent@lightning|top@lightning	HOT	1 Dumb mistake = nuked my entire lightning node privacy?
1517775	Politics_And_Law	3	1181	0	9	24.2	724606	11095	recent@econ	HOT,SELF_POST_OPP	Retire the Seniors, Not the Student Debt! (WSJ, Oyin Adedoyin)
1517590	bitcoin	1	1162	0	2	35.5	74100	10961	recent@bitcoin|recent@history	HOT	The first Bitcoin Taproot spend transactions - jaonoctus
1518117	BooksAndArticles	2	1067	0	1	12.1	74100	10961	recent@BooksAndArticles|top@BooksAndArticles	HOT	[REVIEW] Accelerando by Charles Stross
1517928	bitcoin_beginners	1	1022	0	8	18.7	532976	114	recent@bitcoin_beginners|top@bitcoin_beginners|recent@econ	HOT	The role of cash (banknotes) in a post fiat society
1517992	econ	2	769	0	10	17.5	88718	44922	recent@econ|top@econ	SELF_POST_OPP	Top ~Econ Posts of Q2
1517877	bitcoin	1	742	0	3	20.6	1517877	4	recent@bitcoin|top@bitcoin		Solar ASIC – Automate Bitcoin miners with your solar surplus (Home Assistant)
1517993	econ	2	730	0	8	17.5	724606	11095	recent@econ|top@econ	SELF_POST_OPP	The Egg Clearinghouse is Eggcellent (Money Stuff, Matt Levine)
1517875	bitcoin	1	713	0	1	20.6	280679	22322	recent@bitcoin|top@bitcoin		Rajarshi Maitra Found a Point of Light in the Dark Cave, Quit His Job, and ...
1517760	Design	2	698	0	0	24.7	383547	3285	recent@Design		Earth Garden
1517881	Stacker_Stocks	2	665	0	3	20.3	280679	22322	recent@Stacker_Stocks|top@Stacker_Stocks		Lime raises $167M in IPO after years of teasing a public debut
1517685	bitcoin_beginners	1	604	0	5	27.4	104755	12499	recent@bitcoin_beginners		Reconnected my Send capability with Blink
1517830	AI	1	594	0	4	22.2	74100	10961	recent@AI|top@AI		Toward Unrestricted Intelligence: Venice Series A - Erik Voorhees
1517812	history	2	594	0	2	23.1	1512518	34	recent@history|top@history		Daily Bitcoin Lore (12 years ago): Newegg Accepts Bitcoin via BitPay
1517735	lightning	1	574	0	4	25.2	440729	180	recent@lightning		Biggest Channel Opened Today (7.5 BTC) + New Node Spotlight (02719f6b60955e647…)
1517937	bitcoin	1	572	0	0	18.4	74100	10961	recent@bitcoin|top@bitcoin|recent@mempool		Satoshi and Hal Finney first describing a mempool in November 2008
1518011	Stacker_Stocks	2	569	0	2	17.3	280679	22322	recent@Stacker_Stocks|top@Stacker_Stocks		Robinhood Chain goes live on mainnet alongside 24/7 tokenized stocks
1517717	gaming	3	553	0	3	25.5	163128	3633	recent@lightning		1-SAT RUNNER
1517854	bitcoin	1	506	0	0	21.4	74100	10961	recent@bitcoin|top@bitcoin		Trilithium: Efficient and Universally Composable Distributed ML-DSA Signing
1517704	bitcoin	1	459	0	7	26.3	238412	189	recent@bitcoin|recent@econ|recent@ideasfromtheedge		The Hodl Era Is Over
1517805	meta	1	422	0	6	23.4	36151	1537	recent@meta|top@meta		What are you working on this week?
1518054	AI	1	377	0	1	15.8	74100	10961	recent@bitcoin|top@bitcoin|recent@AI		Is everybody pivoting to AI?
1517687	AI	1	373	0	0	27.3	280679	22322	recent@AI		Claude Helped a Hacker Find a Way to Issue Tickets to Almost Every US Music Fest
1517621	AI	1	367	0	4	31.6	1	26770	recent@AI		Redeploying Claude Fable 5
1518017	food_and_drinks	3	356	0	0	17.1	280679	22322	recent@econ|top@econ|recent@charts_and_maps		How does food get traded around the world?
1517833	gaming	3	341	0	1	22.1	12309	3564	recent@tech|top@tech		Sony is killing discs — and showing us why it’s a terrible idea
1517793	history	2	340	0	2	23.9	1512518	34	recent@history|top@history		Daily Bitcoin Lore (11 years ago): DEA Agent Steals $700K
1517895	science	2	336	0	3	19.8	88718	44922	recent@science|top@science		World Cup Gets Grass While the NFL Plays on Plastic - Doctor Reveals the Truth
1517699	podcasts	2	317	0	2	26.6	9274	24212	recent@history|recent@podcasts		Everything Everywhere Daily:  Bobby Bonilla Day •
1517886	AI	1	295	0	0	20.1	1293586	1986	recent@AI|top@AI|recent@econ		Companies rehire workers laid off for AI as automation falls short
1517658	meta	1	293	0	0	28.4	36151	1537	recent@meta		This Day on SN: July 1
1517630	lightning	1	290	0	0	30.6	70864	347	recent@lightning		Release 5.0.1: Valet with flavors - Regtest, Testnet3, Testnet4
1517688	Stacker_Stocks	2	289	0	3	27.0	280679	22322	recent@Stacker_Stocks		IREN Added to Russell 1000 Index
1518087	tech	1	281	0	0	15.1	161788	10042	recent@tech|top@tech		ZCode – Harness for GLM-5.2
1517919	tech	1	275	0	2	19.1	144357	4307	recent@tech|top@tech		Meet Fio: the Catholic alternative to Spotify
1518025	bitcoin	1	261	0	0	16.8	74100	10961	recent@bitcoin|top@bitcoin|recent@lightning		cerberus: Bark BTC-Ark Swap Protocol - stutxo
1517926	gaming	3	257	0	0	18.8	13531	1659	recent@tech|top@tech		Xbox testing disc-to-digital feature that digitizes a physical game collection
1517708	econ	2	253	0	2	25.8	280679	22322	recent@econ		Roundup #84: Bears on bikes
1518064	lol	2	250	0	1	15.6	280679	22322	recent@lol|top@lol		Senegalese player blocks a penalty kick right at the end of extra time!
1518119	nostr	1	216	0	0	12.1	144357	4307	recent@nostr|top@nostr		Sidecar | A Classy Nostr Signer - Chrome Web Store
1518090	news	2	211	0	0	14.7	297791	7603	recent@news|top@news		Apple’s entry-level MacBook Pro could be up for a redesign
1518097	Stacker_Stocks	2	195	0	1	14.2	9274	24212	recent@Stacker_Stocks|top@Stacker_Stocks		Saylorboi Livingston is back with MSTR LEAPS $345 Strike @ 12/8/15 expiry.
1517852	lol	2	151	0	1	21.5	280679	22322	recent@lol|top@lol		The weirdest song I ever made
1517922	Construction_and_Engineering	2	149	0	3	19.0	280679	22322	recent@Construction_and_Engineering|top@Construction_and_Engineering		Canada is (Finally) Building a Supertall Skyscraper | The B1M
1517828	AI	1	105	0	0	22.4	88718	44922	recent@AI|top@AI		Why Bernie Sanders’s AI Bill Is Fascistic and Dangerous
1517771	Politics_And_Law	3	105	0	0	24.3	88718	44922	recent@econ		Hantavirus: Market versus Government Disease Control
1518289	Politics_And_Law	3	96	0	2	0.6	74100	10961	recent@econ|top@econ|recent@Stacker_Stocks	FRESH	The Secret History of Polymarket: Part 1 - Whitney Webb and Mark Goodwin
1518156	Construction_and_Engineering	2	85	0	0	8.7	1022234	532	recent@Construction_and_Engineering|top@Construction_and_Engineering		PoW 7/1/26
1518256	econ	2	62	0	0	1.5	402772	22140	recent@econ|top@econ	FRESH	U.S. added 57,000 jobs in June, less than expected; unemployment rate at 4.2%
1517606	bitcoin	1	57	0	0	34.3	1517606	3	recent@bitcoin_beginners|recent@Education		Building a non-nonsense "pass-along" Bitcoin brochure. What am I missing?
1517907	BooksAndArticles	2	57	0	0	19.4	1264102	41	recent@BooksAndArticles|top@BooksAndArticles		50 Reasons Paper Books are Better than E-Books
1518158	Politics_And_Law	3	47	0	1	8.5	642641	7877	recent@econ|top@econ|recent@history		The Collapse of US Diplomatic Integrity- Trumps Corruption of US Foreign Policy.
1517974	bitcoin_beginners	1	36	0	0	17.8	296825	4747	recent@bitcoin_beginners|top@bitcoin_beginners		The Politics of Post-Quantum Bitcoin
1517632	bitcoin_beginners	1	36	0	0	30.4	1473003	32	recent@bitcoin_beginners		An analysis of the Funding Rate in cryptocurrency perpetual futures
1518180	bitcoin	1	36	0	0	6.1	1401899	197	recent@history|top@history		Episode #3 — The Man Who Spent 10,000 Bitcoin to Save a Dog
1517689	Stacker_Stocks	2	33	0	16	26.9	9274	24212	recent@Stacker_Stocks		Daily Stock Discussion ~Stacker_Stocks
1518150	bitcoin	1	24	0	2	9.1	1401899	197	recent@history|top@history		Bitcoin Stories #2 — The Night the Network Refused to Die
1518208	Stacker_Stocks	2	22	0	1	4.5	9274	24212	recent@Stacker_Stocks|top@Stacker_Stocks		Daily Stock Discussion ~Stacker_Stocks
1518300	bitcoin	1	21	0	1	0.3	699824	155	recent@lightning|top@lightning	FRESH	Breez's Class of Q2 2026 👀⚡️ - 13 more apps featured!
1517622	AI	1	21	0	0	31.4	934367	919	recent@AI		Introducing Claude Sonnet 5 \ Anthropic
1517643	bitcoin_beginners	1	19	0	1	29.4	296825	4747	recent@bitcoin_beginners		Why Keonne Rodriguez Is in Prison for Building Samourai Wallet
1517615	bitcoin	1	11	0	1	33.3	1401899	197	recent@bitcoin_Mining		Bitcoin Stories — How Iran Became an Accidental Mining Powerhouse
1518249	news	2	10	0	0	1.9	297791	7603	recent@news|top@news	FRESH	Google loses fight over record $4.7 billion EU antitrust fine
1518246	lightning	1	0	0	5	1.9	263526	446	recent@lightning|top@lightning	FRESH	@TheBlueMatt 🟠 Lightning payment 99% success rates is remotely acceptable
1518270	lightning	1	0	0	0	1.2	440729	180	recent@lightning|top@lightning	FRESH	Biggest Channel Opened Today (6.0 BTC) + New Node Spotlight (03b1561ba1ef7f4de…)
1518159	Politics_And_Law	3	0	0	0	8.4	1054143	966	recent@econ|top@econ|recent@history		World Bank approves $1.25bn Nigeria loan despite backlash
1518307	Stacker_Stocks	2	0	0	1	0.1	280679	22322	recent@Stacker_Stocks|top@Stacker_Stocks	FRESH	After $18B IPO, Bending Spoons founder says success comes from minimizing luck
1518153	Stacker_Stocks	2	0	0	0	8.9	1054143	966	recent@Stacker_Stocks|top@Stacker_Stocks		NGX investors lose N2.39tn as profit-taking triggers stock market sell-off
1518225	charts_and_maps	2	0	0	0	3.6	280679	22322	recent@charts_and_maps|top@charts_and_maps		Which Continents Have the Most Drug Users?
1518207	news	2	0	0	0	4.5	126503	781	recent@news|top@news		Google loses fight against record €4.1 billion EU antitrust fine
