# id	sub	tier	score	bounty	ncom	ageH	op_since	op_nitems	hits	tags	title
1521798	tech	1	3387	0	2	7.8	1495204	14	recent@lightning|top@lightning|recent@tech	HOT,SIGNAL	Running Boltz, One Of The Oldest And Largest Lightning Nodes
1521807	bitcoin	1	1507	0	1	7.4	30782	25082	recent@bitcoin|top@bitcoin	HOT,SIGNAL	Programming Blockchain (Get past the title)
1521963	meta	1	1314	0	5	1.7	48657	14134	recent@meta|top@meta	FRESH,HOT,SIGNAL	Stacker News Monthly: May / June 2026 Doubleheader!
1521832	bitcoin	1	651	0	0	6.4	74100	11080	recent@bitcoin|top@bitcoin	SIGNAL	Bypassing Tangem Card Security with a Laser Attack | Ledger Donjon
1521949	tech	1	497	0	0	2.1	161788	10081	recent@tech|top@tech	SIGNAL	GPT-5.6
1521865	bitcoin	1	444	0	0	4.4	133081	675	recent@bitcoin|top@bitcoin	SIGNAL	The Ultimate Bitcoin Backup: Computing Codex32 Seed Shares with Pen and Paper.
1521903	bitcoin	1	264	0	10	3.2	1202928	218	recent@bitcoin|top@bitcoin|recent@lightning	SIGNAL	PREDYX Is Already the Strongest BIP-110 Signal — 2+ BTC in Trading Volume ⚡
1521792	AI	1	235	0	0	8.0	280679	22400	recent@AI|top@AI	SIGNAL	Set up OpenClaw on your Raspberry Pi
1521817	lightning	1	113	0	0	7.1	440729	187	recent@lightning|top@lightning	SIGNAL	Biggest Channel Opened Today (5.0 BTC) + New Node Spotlight (03eb782adce5c2bae…)
1521830	security	1	110	0	0	6.5	297791	7613	recent@security|top@security|recent@devs	SIGNAL	How to implement a continuous offensive security testing program
1521827	Travel	3	109	0	3	6.6	1521827	2	recent@privacy|top@privacy|recent@tech	SIGNAL	I built a no-KYC travel eSIM you can buy with Bitcoin - no email, no account
1521232	bitcoin	1	11538	0	7	34.9	176202	36	recent@bitcoin	HOT	Bull Bitcoin is officially opening the first legal front against DAC8 in Europe
1521286	lightning	1	2514	0	16	32.7	263526	459	recent@lightning	HOT	@Polymarket now supports instant Bitcoin deposits over Lightning
1521341	bitcoin	1	1319	0	7	30.0	14476	298	recent@bitcoin	HOT	That time Gregory Maxwell sent 21M bitcoins to himself.
1521438	bitcoin	1	1084	0	0	27.1	74100	11080	recent@bitcoin|recent@bitcoin_Mining	HOT	Crestmont Fabrics Ltd mines a bitcoin block
1521494	bitcoin	1	903	0	8	25.5	74100	11080	recent@bitcoin|recent@lightning		Case study: a real Spark unilateral exit on Bitcoin mainnet - Openoms
1521706	AI	1	846	0	3	14.8	74100	11080	recent@AI|top@AI		Phantasm: Self-hosted AI chat for iOS - benthecarman
1521385	bitcoin	1	845	0	0	28.9	1014665	200	recent@bitcoin		Conduition, Jeremy Rubin - Bitcoin Optech Newsletter #412 Recap Podcast
1521368	bitcoin	1	747	0	16	29.3	74100	11080	recent@bitcoin|recent@lightning		Breez SDK Spark and Radar Chat: Recovery Phrase Is Not the Same as Self-Custody
1521301	privacy	1	624	0	3	32.2	1482150	19	recent@privacy		EU Parliament Revives Chat Surveillance for Thursday Vote
1521293	bitcoin	1	607	0	0	32.5	280679	22400	recent@bitcoin		Release Bitcoin Core 31.1
1521660	bitcoin	1	548	0	0	18.7	223678	5770	recent@bitcoin|top@bitcoin		Socks for Sats! Guys you can now buy socks with bitcoin with Cape Cotton!
1521681	bitcoin	1	497	0	6	17.3	2795	1346	recent@bitcoin|top@bitcoin|recent@lightning		942 bitcoin transactions routed this week on my "meaningless pleb node" ⚡⚡
1521370	science	2	452	0	0	29.2	996769	39	recent@bitcoin_beginners		🎙️ The Template Behind Every Psyop: How the Global Control System Really Works
1521346	AI	1	448	0	0	29.9	401865	8241	recent@AI		OpenAI to Publicly Release GPT-5.6 AI Models, Ending Government-Requested Limits
1521282	lightning	1	412	0	1	32.9	263526	459	recent@lightning		Forget Tron Fees: Instant Private USDT Swaps On Bitcoin Lightning Are Here
1521619	nostr	1	373	0	2	21.2	1521619	4	recent@nostr|top@nostr		Mirror your X posts to Nostr (Vise Versa)-Background synced with analytics -Xstr
1521239	AI	1	342	0	0	34.6	879734	7633	recent@AI		LeRobot v0.6.0: Imagine, Evaluate, Improve
1521423	bitcoin	1	331	0	0	27.5	74100	11080	recent@bitcoin|recent@bitcoin_Mining		Miner Signaling via DMND Stratum V2: You Decide What to Signal
1521364	tech	1	306	0	0	29.4	140698	1080	recent@tech		All Cars Sold in the EU Now Require a Camera Aimed at Your Face.
1521541	tech	1	303	0	0	24.0	12309	3580	recent@tech		PSA: macOS 28 will drop support for encrypted Mac OS Extended volumes
1521363	meta	1	247	0	4	29.4	36151	1546	recent@meta		What are you working on this week?
1521324	lightning	1	243	0	1	31.2	440729	187	recent@lightning		Biggest Channel Opened Today (5.0 BTC) + New Node Spotlight (0381434180279cbcc…)
1521538	bitcoin	1	174	0	0	24.1	1054143	972	recent@bitcoin_beginners|recent@bitcoin_Mining		Bitcoin Weakens as Trump’s Remarks Raise Fresh Iran War Concerns
1521281	bitcoin	1	168	0	1	33.1	1490792	259	recent@bitcoin_beginners		Bitcoin After Block Rewards
1521486	AI	1	167	0	1	25.9	12309	3580	recent@AI		JEDEC releases new SPHBM4 standard to slash AI memory costs
1521241	AI	1	150	0	0	34.5	356670	352	recent@AI		Bitmagic - Build any game instantly with AI
1521562	events	3	124	0	0	23.2	296825	4800	recent@bitcoin_beginners|top@bitcoin_beginners		Africa ₿itcoin Conference: Got any questions about ABC26?
1521503	Geyser_community	3	120	0	0	24.8	296825	4800	recent@bitcoin_beginners|recent@bitdevs|recent@lightning		Bitcoin Projects in Africa | African Bitcoiners
1521529	tech	1	100	0	0	24.2	12309	3580	recent@devs		GitHub Has Restricted Access to Star Data (Github banned star-history.com)
1521522	bitcoin_beginners	1	98	0	0	24.3	296825	4800	recent@bitcoin_beginners|recent@bitdevs		Today in History: Can a nation-wide Internet firewall stop Bitcoin?
1521273	bitcoin	1	87	0	3	33.4	1490792	259	recent@bitcoin_beginners|recent@lightning		Radar Chat Brings Self-Custodial Lightning Payments to Encrypted Messaging
1521873	bitcoin	1	82	0	0	4.3	296825	4800	recent@bitcoin_beginners|top@bitcoin_beginners|recent@lightning		Block to pay $45 million after states say it made false security promises
1521524	AI	1	69	0	0	24.3	462245	284	recent@AI		Encrypted Media — The ContextVM World #12 🌍
1521657	AI	1	63	0	0	18.7	1520551	8	recent@AI|top@AI		Home | CASH ORBIT
1521556	bitcoin_beginners	1	56	0	0	23.4	296825	4800	recent@bitcoin_beginners|top@bitcoin_beginners|recent@bitcoin_Mining		How Bitcoin Could Reuse Signatures Across Compatible UTXOs
1521544	bitcoin_beginners	1	56	0	0	23.8	296825	4800	recent@bitcoin_beginners|top@bitcoin_beginners		Feeling fiat-blindness or something? Might be suffering from Shitcoinosis...
1521917	AI	1	40	0	0	2.6	296825	4800	recent@AI|top@AI		World's First Fully Robotic Pharmacy Automates Prescription Dispensing
1521575	bitcoin_beginners	1	36	0	1	22.3	1444593	76	recent@bitcoin_beginners|top@bitcoin_beginners		🔒 Errores para perder tus bitocin. Cambiar el orden de las palabras
1521249	bitcoin	1	36	0	1	34.2	1490792	259	recent@bitcoin_beginners|recent@lightning		Bitcoin Layer 2 Implementations - Complete List
1521316	bitcoin	1	36	0	0	31.6	1521316	3	recent@bitcoin_beginners		The prisoners meet the generals
1521714	bitcoin	1	36	0	2	13.3	296825	4800	top@bitcoin_beginners|top@bitcoin_Mining|top@bitcoinplusplus		What is one thing you think many people underestimate?
1521667	AI	1	20	0	1	18.3	61367	212	recent@AI|top@AI		AI is failing because Energy is under gatekeeping
1521789	bitcoin	1	0	0	0	8.5	280679	22400	recent@bitcoin_Mining|top@bitcoin_Mining		Fee Selection for CTV-Based Mining Pool Fanouts
1521515	bitcoin	1	0	0	0	24.6	296825	4800	recent@bitcoinplusplus|recent@bitdevs		StarkWare CEO Proposed 4% Bitcoin Inflation Model
1521781	lightning	1	0	0	3	8.8	263526	459	recent@lightning|top@lightning		Voltage self-serve lightning closing down - any alternative?
1521809	lightning	1	0	0	1	7.3	263526	459	recent@lightning|top@lightning		Hosted Bitcoin Lightning Node with Clovyr
1521414	security	1	0	0	0	28.0	297791	7613	recent@security		15yo GhostLock Flaw Enables Root and Container Escape on Most Linux Distros
1521930	tech	1	0	0	0	2.4	296825	4800	recent@devs|top@devs		Lan Chat: Serverless LAN IPv6-only multicast chat & voice app in Rust
1521823	AI	1	0	0	0	6.8	297791	7613	recent@devs|top@devs|recent@AI		GitHub Copilot in Visual Studio Code, June 2026 releases
1521974	AI	1	0	0	0	1.5	296825	4800	recent@AI|top@AI	FRESH	TEE-Encrypted LLMs Now Available Via Routstr: E2EE, Pay-per-Request, No Accounts
1521860	AI	1	0	0	0	4.7	296825	4800	recent@AI|top@AI		Routstr - Decentralized AI Inference Router
