# id	sub	tier	score	bounty	ncom	ageH	op_since	op_nitems	hits	tags	title
1504013	bitcoin	1	1186	0	0	6.0	1014665	188	recent@bitcoin|top@bitcoin	HOT,SIGNAL	Bitcoin Kernel dev/Bitcoin Core maintainer on validation logic in Bitcoin Core
1504024	AI	1	1143	0	1	5.1	80482	984	recent@bitcoin|top@bitcoin|recent@AI	HOT,SIGNAL	AI Stock meltdown? [megathread]
1503996	nostr	1	987	0	2	7.4	166	36426	recent@nostr|top@nostr	SIGNAL	Nostrord - decentralized group chat on Nostr
1504030	AI	1	300	0	0	4.6	12309	3504	recent@tech|top@tech|recent@AI	SIGNAL	AMD Believes Unified Memory Architectures Open Up a "World of Possibilities"
1504015	meta	1	114	0	0	5.7	36151	1504	recent@meta|top@meta	SIGNAL	This Day on SN: June 7
1504050	lightning	1	112	0	2	3.9	263526	363	recent@lightning|top@lightning	SIGNAL	Anonymous cash for Bitcoin Lightning at nearly all Polish ATMs.
1503887	the_stacker_muse	3	10453	0	9	16.7	900202	2336	recent@bitcoin|top@bitcoin	HOT,SELF_POST_OPP	[HM] Adventures of PLATO: The World's First Bitcoin Road Trip
1503935	art	3	4063	0	10	13.2	1503935	5	recent@bitcoin|top@bitcoin|recent@bitcoin_beginners	HOT,SELF_POST_OPP	A Japanese artist drew an 84-page Bitcoin manga. We translated it into English
1503666	bitcoin_beginners	1	1283	0	13	24.7	793757	125	recent@bitcoin_beginners	HOT	"I'm confused... how can I own less than one Bitcoin!??"
1503821	bitcoin_Mining	1	1241	0	2	19.7	864760	44	recent@bitcoin_Mining|top@bitcoin_Mining	HOT	Building the first 1,000-Bitcoiner mining party.
1503833	meta	1	1155	0	0	18.9	1	26565	recent@meta|top@meta	HOT	SN Saturday Newsletter 6/6/26
1503653	bitcoin	1	1106	0	4	26.1	74100	10337	recent@bitcoin|recent@bitdevs|recent@lightning	HOT	Rug the mints - @1440000bytes
1503813	bitcoin	1	1085	0	0	19.9	1481415	23	recent@bitcoin|top@bitcoin|recent@bitdevs	HOT	DC BitDevs #20
1503715	privacy	1	1033	0	26	22.7	74100	10337	recent@privacy|top@privacy	HOT	Age verification company Yoti rejects user for using GrapheneOS
1503811	nostr	1	763	0	2	19.9	6263	10485	recent@nostr|top@nostr		Takedown request from Munich court for a nostr post accessed via njump
1503822	DIY	3	714	0	3	19.6	642641	7715	recent@bitcoin_Mining|top@bitcoin_Mining		A Cheap DIY Solar Hack Is Catching On. Can It Cut Your Energy Bill?
1503872	news	2	684	0	0	17.8	1473856	10	recent@bitcoin|top@bitcoin		Payment Adoption Weekly Brief 2026/23
1503788	bitcoin_beginners	1	463	0	1	20.7	296825	4556	recent@bitcoin_beginners|top@bitcoin_beginners		Unruggable Cashu Mints
1503555	AI	1	457	0	1	33.0	12309	3504	recent@bitcoin|recent@AI		"Banks Are Choking": The AI Debt Bubble Has Started To Burst
1503934	art	3	371	0	3	13.4	798714	1299	recent@bitcoin|top@bitcoin		Proof of Work - Chapter 1
1503812	lol	2	323	0	1	19.9	74100	10337	recent@AI|top@AI		If LLMs Have Human-Like Attributes, Then So Does Age of Empires II
1503707	bitcoin_beginners	1	261	0	0	22.9	296825	4556	recent@bitcoin_beginners|top@bitcoin_beginners|recent@lightning		Numo Pay Release v1.6
1503783	AI	1	244	0	1	20.8	328182	3703	recent@AI|top@AI		The Trump administration might take an equity stake in OpenAI
1503589	meta	1	221	0	2	29.7	36151	1504	recent@meta		This Day on SN: June 6
1503654	bitcoin_beginners	1	166	0	1	26.0	296825	4556	recent@bitcoin_beginners|recent@lightning		ZEUS v13.1.0-beta1 is now available for testing.
1503567	bitcoin_Mining	1	138	0	0	31.9	1503567	7	recent@bitcoin_Mining		Python Bitcoin Miner
1503607	AI	1	105	0	2	28.0	328182	3703	recent@AI		Why Google Just Gave Away Gemma 4 for Free
1503574	AI	1	105	0	4	30.7	110937	241	recent@AI		Do you really need more ideas?
1503661	bitcoin_beginners	1	98	0	0	25.4	296825	4556	recent@bitcoin_beginners|recent@lightning		Agora Launched at Oslo Freedom Forum: What we built and why - Soapbox Blog
1503664	AI	1	69	0	1	25.0	12309	3504	recent@AI		Can Tech Legends Find the Liar? (Mafia Episode 1)
1504045	AI	1	40	0	0	4.2	9274	23222	recent@AI|top@AI		🍟 Chips ’n’ dips - Snacks
1504130	bitcoin	1	36	0	0	0.5	996769	35	recent@bitcoin_beginners|top@bitcoin_beginners	FRESH	🎙️NEW EPISODE: The Bitcoiner Hero's Journey
1504133	bitcoin_beginners	1	36	0	0	0.4	1503981	5	recent@bitcoin_beginners|top@bitcoin_beginners	FRESH	How bitcoin transcation works
1504004	bitcoin	1	36	0	0	6.6	1504003	3	recent@bitcoin_beginners|top@bitcoin_beginners|recent@bitcoin_Mining		Miners Go AI, BTC Backs Mortgages & ETF Streak Hits Record
1503981	bitcoin_beginners	1	36	0	1	9.1	1503981	5	recent@bitcoin_beginners|top@bitcoin_beginners		what was the moment Bitcoin finally clicked for you?
1503645	bitcoin_beginners	1	36	0	1	26.8	296825	4556	recent@bitcoin_beginners|recent@lightning		Global Movement For Bitcoin Education
1503641	bitcoin	1	36	0	0	27.0	1500564	15	recent@bitcoin_beginners|recent@bitcoinplusplus		CBBI is in the 30s on this dip — here's what that zone meant before
1504075	AI	1	21	0	1	2.6	1499354	6	recent@lightning|top@lightning|recent@AI		I built an AI agent that runs a NOSTR business — and pays its own way in sats
1504102	AI	1	21	0	0	1.1	370699	254	recent@devs|top@devs|recent@AI	FRESH	CLI filter that saved 91.8% of my LLM tokens | Hacker News
1504143	bitcoin	1	0	0	0	0.2	74100	10337	recent@bitdevs|top@bitdevs	FRESH	BIP 110 debate between Chris Guida and Supertestnet
1504113	lightning	1	0	0	0	1.0	440729	131	recent@lightning|top@lightning	FRESH	Biggest Channel Opened Today + New Node Spotlight
1503662	lightning	1	0	0	0	25.3	440729	131	recent@lightning		Biggest Channel Opened Today + New Node Spotlight
1504150	devs	1	0	0	0	0.2	382968	302	recent@devs|top@devs	FRESH	The `arg0` trick
1503700	AI	1	0	0	5	23.2	5888	269	recent@AI|top@AI		LogicSrc: AgentSpec for openspec.dev
1503656	AI	1	0	0	0	25.7	1503567	7	recent@AI		The 'Apple Tax''s Openclaw and The Hackintosh Miracle
