# id	sub	tier	score	bounty	ncom	ageH	op_since	op_nitems	hits	tags	title
1525788	bitcoin	1	10661	0	11	6.6	30782	25136	recent@bitcoin|top@bitcoin	HOT,SIGNAL	When The Financial System Can’t Reach People In Crisis, Bitcoin Can
1525893	gaming	3	1678	0	4	3.0	13531	1677	recent@tech|top@tech	HOT,SIGNAL	The PS6 sure sounds like a handheld
1525899	AI	1	1168	0	1	2.7	13531	1677	recent@privacy|top@privacy|recent@tech	HOT,SIGNAL	COMPUTER COPS: Inside the big business of selling AI to the police
1525907	bitcoin	1	1037	0	1	2.5	724606	11523	recent@bitcoin|top@bitcoin	HOT,SIGNAL	BOOK on BOOKS: "Hijacking Bitcoin: The Hidden History of BTC," by Roger Ver
1525829	lightning	1	803	0	4	4.9	263526	480	recent@lightning|top@lightning	SIGNAL	WoS adds Stablecoins on Lightning
1525818	AI	1	782	0	2	5.0	280679	22447	recent@AI|top@AI	SIGNAL	Linus Torvalds tells AI haters to fork off
1525904	bitcoin	1	734	0	4	2.6	74100	11260	recent@bitcoin|top@bitcoin	SIGNAL	📣 AMA Announcement: Mechanic - FRIDAY 1PM
1525867	bitcoin	1	667	0	2	3.8	74100	11260	recent@bitcoin|top@bitcoin|recent@bitcoin_beginners	SIGNAL	hardware wallets vs dedicated generic devices
1525836	AI	1	455	0	0	4.7	401865	8282	recent@AI|top@AI	SIGNAL	Nvidia Unveils New AI Model and Expands Japan’s Physical AI Ecosystem
1525752	lightning	1	402	0	2	8.3	263526	480	recent@lightning|top@lightning	SIGNAL	"Be your own bank" they say, gain a 3% APY. That's a -1% APY 4yo LN node story
1525947	nostr	1	342	0	0	1.5	1496326	10	recent@nostr|top@nostr	FRESH,SIGNAL	Cordn multi-device is here 💻📱💻
1525920	bitcoin_beginners	1	321	0	1	2.1	296825	4855	recent@bitcoin_beginners|top@bitcoin_beginners|recent@bitcoin_Mining	SIGNAL	Parasite has now started gaining network hashrate
1525847	security	1	311	0	1	4.4	74100	11260	recent@security|top@security	SIGNAL	Why I'm no longer an "ethical hacker" - Juraj Bednar
1525776	bitcoin	1	297	0	0	7.1	263526	480	recent@bitcoin|top@bitcoin	SIGNAL	Your Bitcoin Live Dashboard: Price, Hashrate, Halving & On-Chain Data
1525810	Geyser_community	3	138	0	1	5.5	296825	4855	recent@bitcoin_beginners|top@bitcoin_beginners|recent@lightning	SIGNAL	Introducing the Open Study Hubs logo
1525856	lightning	1	138	0	0	4.1	440729	195	recent@lightning|top@lightning	SIGNAL	Biggest Channel Opened Today (5.0 BTC) + New Node Spotlight (032d728c40af0db62…)
1525365	bitcoin	1	2128	0	9	26.0	1420309	24	recent@bitcoin	HOT	Ark Support in Hal wallet
1525541	the_stacker_muse	3	1795	0	34	21.8	74100	11260	recent@bitcoin|top@bitcoin	HOT	Bitcoin History Month Prizes
1525306	bitcoin	1	1662	0	17	27.1	223678	5789	recent@bitcoin	HOT	Please Sign Change.Org Petition To Stop Bitcoin Spam
1525248	lightning	1	1640	0	4	28.8	1297604	18	recent@lightning	HOT	Free Channels / Liquidity Giveaway
1525199	Design	2	1409	0	15	30.3	1490380	22	recent@bitcoin_Mining	HOT,SELF_POST_OPP	Naming a simple open source mining app
1525354	bitcoin	1	1373	0	17	26.5	74100	11260	recent@bitcoin	HOT	ORANGE JUICE Raises $40 Million for Bitcoin Treasury Permanent Capital Company
1525728	bitcoin_beginners	1	1350	0	6	12.4	146922	57	recent@bitcoin_beginners|top@bitcoin_beginners	HOT	Can Bitcoin Be Destroyed?
1525656	bitcoin	1	1338	0	9	17.1	296825	4855	recent@bitcoin|top@bitcoin|recent@bitcoin_beginners	HOT	The African Bitcoin ecosystem has a credibility crisis
1525610	bitcoin	1	1093	0	5	19.1	74100	11260	recent@bitcoin|top@bitcoin|recent@bitcoin_Mining	HOT	BIP-110 - My Notes to Miners - Jason Hughes
1525586	bitcoin	1	1068	0	3	20.0	7693	2375	recent@bitcoin|top@bitcoin|recent@bitcoin_beginners	HOT	My First Vibe Coded "App": The Bitcoin Price Database
1525171	bitcoin	1	1035	0	3	32.4	256599	718	recent@bitcoin	HOT	Case study: a real Spark unilateral exit on Bitcoin mainnet
1525547	AI	1	706	0	8	21.6	12315	2248	recent@AI|top@AI		AI Isn't A Bubble And Its Buildout Is Accelerating
1525166	Design	2	687	0	2	32.9	1278026	641	recent@bitcoin		The phenomenon of Chesterton's fence in relation to bip110 & the blocksize wars
1525487	math	2	555	0	1	23.4	74100	11260	recent@bitcoin|top@bitcoin		Proving Ownership After Q-Day: new post-quantum primitive - Project Eleven
1525706	bitcoin	1	521	0	3	14.0	74100	11260	recent@bitcoin|top@bitcoin|recent@devs		Nunchuk adds USDT support on Liquid
1525346	bitcoin	1	463	0	2	26.6	263596	220	recent@bitcoin		Jeff Booth is launching a new venture called Orange Juice
1525344	AI	1	391	0	1	26.6	934367	930	recent@AI		Introducing Muse Spark 1.1
1525353	news	2	342	0	0	26.5	349373	8	recent@bitcoin|recent@devs|recent@tech		Resolvr Launches Apogee Web Wallet
1525356	meta	1	325	0	5	26.4	36151	1555	recent@meta		What are you working on this week?
1525556	bitcoin_beginners	1	240	0	0	21.2	296825	4855	recent@bitcoin_beginners|top@bitcoin_beginners		Self Custody Education Contest! | ColdCard
1525395	bitcoin	1	184	0	1	25.1	1230021	22	recent@bitcoin		BIP 110 Explained: Bitcoin's Biggest Battle
1525206	AI	1	151	0	0	30.1	1490792	293	recent@AI		South Korea launches free AI agent project for all citizens - UPI.com
1525540	bitcoin_beginners	1	138	0	0	21.9	296825	4855	recent@bitcoin_beginners|top@bitcoin_beginners|recent@bitcoinplusplus		Demonstration Of "Attack Blocks" On Bitcoin's Signet Test Network
1525553	bitcoin_beginners	1	100	0	0	21.4	296825	4855	recent@bitcoin_beginners|top@bitcoin_beginners|recent@bitcoinplusplus		Transparency - OpenSats
1525930	bitcoin_beginners	1	94	0	0	1.9	296825	4855	recent@bitcoin_beginners|top@bitcoin_beginners|recent@bitcoinplusplus	FRESH	ABC2026 Conference To Conclude With A Spectacular ABC Fest Celebration
1525278	lightning	1	78	0	0	28.0	263526	480	recent@lightning		Faster Transactions Are Drawing Users Toward Bitcoin Payments
1525233	lightning	1	69	0	0	29.3	280679	22447	recent@lightning		Lightning Liquidity Is Solved. It's Just Not Evenly Distributed Yet
1525271	bitcoin_beginners	1	67	0	0	28.1	296825	4855	recent@bitcoin_beginners|recent@bitcoin_Mining		Proves Bitcoin Miners Own the Power Grid
1525958	bitcoin	1	57	0	2	1.2	296825	4855	recent@bitcoin_beginners|top@bitcoin_beginners|recent@bitcoinplusplus	FRESH	Cupcake - Your old phone? Your new hardware wallet
1525378	math	2	57	0	0	25.6	296825	4855	recent@bitcoin_beginners		The "Physics" That Forgot the Facts
1525289	bitcoin_beginners	1	57	0	0	27.6	296825	4855	recent@bitcoin_beginners		According to Satoshi's publicly available writings, including the Whitepaper
1525554	bitcoin	1	42	0	0	21.3	1495204	20	recent@lightning|top@lightning		RiskPay Launches Affiliate Platform With Lifetime Revenue Share
1525985	bitcoin_beginners	1	36	0	1	0.5	1444593	85	recent@bitcoin_beginners|top@bitcoin_beginners	FRESH	Errores: Confundir la passphrase con el PIN
1525913	bitcoin_beginners	1	36	0	0	2.5	296825	4855	recent@bitcoin_beginners|top@bitcoin_beginners		APPLE INCLUDED THE BITCOIN WHITEPAPER INTO EVERY MAC FOR OVER 4 YEARS. NO EXCUSE
1525529	lightning	1	36	0	0	22.5	1525529	1	recent@lightning|top@lightning		Path Queries V2
1525272	lightning	1	20	0	0	28.1	440729	195	recent@lightning		Biggest Channel Opened Today (5.0 BTC) + New Node Spotlight (0294cd6f26d81abaa…)
1525282	bitcoin_beginners	1	0	0	0	27.8	296825	4855	recent@bitcoin_beginners|recent@bitdevs		On BIP110: Many supporters of BIP110 are acting in good faith but...
1526003	bitcoin_Mining	1	0	0	0	0.0	280679	22447	recent@bitcoin_Mining|top@bitcoin_Mining	FRESH	Enel Partnership: Make Your Flexible Bitcoin Mining Load Pay
1525472	bitcoinplusplus	1	0	0	0	23.8	280679	22447	recent@bitcoinplusplus|top@bitcoinplusplus		Built Here, Used Everywhere: Closing the African Open Source Founder Gap
1525929	bitcoin	1	0	0	0	1.9	699824	160	recent@lightning|top@lightning	FRESH	Breez x Turnkey: Instant Bitcoin at Enterprise Scale 🔥
1525884	AI	1	0	0	0	3.2	1504792	3	recent@AI|top@AI		The ContextVM website now has agent-native payments
1525489	AI	1	0	0	3	23.3	1475330	111	recent@AI|top@AI		Profit or Extinction: When AI Agents Learn to Fight for Survival.
