# id	sub	tier	score	bounty	ncom	ageH	op_since	op_nitems	hits	tags	title
1504464	bitcoin	1	1715	0	3	6.4	109083	231	recent@bitcoin|top@bitcoin	HOT,SIGNAL	THE BITCOIN FARMER (full documentary)
1504581	bitcoin	1	1228	0	3	1.0	48942	1232	recent@bitcoin|top@bitcoin	FRESH,HOT,SIGNAL	The Satoshi Times - Mission Statement
1504453	AI	1	548	0	0	7.4	140698	1070	recent@AI|top@AI	SIGNAL	The OnlyFans Economy of American AI
1504487	nostr	1	395	0	8	4.9	30782	24852	recent@nostr|top@nostr	SIGNAL	nostr wars getting ugly
1504540	AI	1	188	0	0	2.1	401865	8145	recent@AI|top@AI	SIGNAL	Amazon Strikes Multibillion-Dollar Deal w/ Corning to Power U.S. AI Data Centers
1504239	lightning	1	5634	0	24	20.8	9274	23248	recent@lightning|top@lightning	HOT	Square Adventurers: FINALLY SUCCESS bought soap at a local small business
1504404	Geyser_community	3	3066	0	9	12.4	2795	1290	recent@bitcoin|top@bitcoin|recent@bitcoin_beginners	HOT,SELF_POST_OPP	We got our first App donation tonight!
1504013	bitcoin	1	1701	0	0	29.2	1014665	188	recent@bitcoin	HOT	Bitcoin Kernel dev/Bitcoin Core maintainer on validation logic in Bitcoin Core
1504024	AI	1	1688	0	6	28.4	80482	984	recent@bitcoin|recent@AI	HOT	AI Stock meltdown? [megathread]
1504302	bitcoin	1	1180	0	3	18.1	74100	10351	recent@bitcoin|top@bitcoin	HOT	Bitcoin Uncensored Episode 1
1503996	nostr	1	1071	0	8	30.7	166	36430	recent@nostr	HOT	Nostrord - decentralized group chat on Nostr
1504280	AI	1	990	0	4	19.1	4078	5338	recent@AI|top@AI		Majorana 2 – Microsoft's Scalable Quantum Processor With Long-Lasting Qubits
1504143	bitcoin	1	892	0	4	23.5	74100	10351	recent@bitcoin|top@bitcoin|recent@bitdevs		BIP 110 debate between Chris Guida and Supertestnet
1504312	AI	1	876	0	8	17.7	4078	5338	recent@AI|top@AI		sci-bot: LLM model trained on sci-hubs papers
1504194	bitcoin_beginners	1	493	0	2	22.1	296825	4561	recent@bitcoin_beginners|top@bitcoin_beginners|recent@lightning		bitblik — pay with bitcoin, anywhere BLIK works
1504030	AI	1	437	0	0	27.9	12309	3504	recent@tech|recent@AI		AMD Believes Unified Memory Architectures Open Up a "World of Possibilities"
1504201	AI	1	428	0	2	21.9	1293586	1901	recent@AI|top@AI		McDonald's testing AI drive-thru order-taking system called ArchIQ
1504255	bitcoin	1	371	0	4	20.3	178	904	recent@bitcoin|top@bitcoin		Sunday Survey: How much of your wealth is *not* in BTC?
1504130	bitcoin	1	334	0	1	23.7	996769	35	recent@bitcoin|top@bitcoin|recent@bitcoin_beginners		🎙️NEW EPISODE: The Bitcoiner Hero's Journey
1504193	tech	1	326	0	3	22.1	1293586	1901	recent@tech|top@tech		China has approved the world’s first invasive brain-computer chip
1504337	bitcoin	1	306	0	6	16.6	280679	21838	recent@bitcoin|top@bitcoin		In It For the Tech
1504373	bitcoin	1	285	0	6	14.7	1504003	10	recent@bitcoin_beginners|top@bitcoin_beginners|recent@bitcoin_Mining		Can NY's Lost-and-Found Law Claim Your Bitcoin?
1504077	nostr	1	272	0	6	25.6	30782	24852	recent@nostr		nostr mail?
1504220	bitcoin_beginners	1	270	0	3	21.2	296825	4561	recent@bitcoin_beginners|top@bitcoin_beginners		The Bitcoin Farmer
1504102	AI	1	209	0	0	24.4	370699	256	recent@devs|recent@AI		CLI filter that saved 91.8% of my LLM tokens | Hacker News
1504015	meta	1	114	0	0	29.0	36151	1505	recent@meta		This Day on SN: June 7
1504050	lightning	1	112	0	2	27.2	263526	366	recent@lightning		Anonymous cash for Bitcoin Lightning at nearly all Polish ATMs.
1504313	Travel	3	97	0	3	17.5	280679	21838	recent@bitcoin|top@bitcoin		I’m selling my house to buy Bitcoin
1504246	AI	1	90	0	0	20.6	296825	4561	recent@AI|top@AI		How Does LLMs Actually Work?
1504441	lightning	1	84	0	0	9.5	263526	366	recent@lightning|top@lightning		An app that rewards Bitcoin per your mileage & elevation gain, would you use it?
1504113	lightning	1	83	0	0	24.2	440729	131	recent@lightning		Biggest Channel Opened Today + New Node Spotlight
1504045	AI	1	82	0	0	27.4	9274	23248	recent@AI		🍟 Chips ’n’ dips - Snacks
1504582	AI	1	69	0	1	1.0	280679	21838	recent@AI|top@AI	FRESH	"Chat is dead": OpenAI preps overhaul of ChatGPT
1504595	AI	1	69	0	0	0.5	934367	909	recent@AI|top@AI	FRESH	How Did DeepSeek V4 Make V4 So Cheap? - YouTube
1504502	AI	1	69	0	0	3.6	280679	21838	recent@AI|top@AI		Smartphones broke dating. AI might finish the job.
1504330	bitcoin	1	65	0	6	16.7	1504003	10	recent@bitcoin_beginners|top@bitcoin_beginners|recent@bitcoin_Mining		Big news from @satstools.
1504203	bitcoin_beginners	1	36	0	0	21.8	296825	4561	recent@bitcoin_beginners|top@bitcoin_beginners		29: State of the Mint and Mind
1504174	bitcoin	1	36	0	3	22.9	1503981	10	recent@bitcoin_beginners|top@bitcoin_beginners		Bitcoin is more than a number on a screen
1504004	bitcoin	1	36	0	0	29.8	1504003	10	recent@bitcoin_beginners|recent@bitcoin_Mining|recent@bitcoinplusplus		Miners Go AI, BTC Backs Mortgages & ETF Streak Hits Record
1504133	bitcoin_beginners	1	36	0	0	23.7	1503981	10	recent@bitcoin_beginners|top@bitcoin_beginners		How bitcoin transcation works
1503981	bitcoin_beginners	1	36	0	1	32.4	1503981	10	recent@bitcoin_beginners		what was the moment Bitcoin finally clicked for you?
1504075	AI	1	21	0	1	25.8	1499354	6	recent@lightning|recent@AI		I built an AI agent that runs a NOSTR business — and pays its own way in sats
1504446	bitcoin	1	0	0	1	8.9	934367	909	recent@lightning|top@lightning		The Economics of Protocol Design: Proposing Lightning over Ark‬ - YouTube
1504150	devs	1	0	0	1	23.4	382968	304	recent@devs|top@devs		The `arg0` trick
1504607	AI	1	0	0	0	0.1	934367	909	recent@AI|top@AI	FRESH	DeepSWE: Measuring frontier coding agents on original, long-horizon tasks
