# id	sub	tier	score	bounty	ncom	ageH	op_since	op_nitems	hits	tags	title
1505845	lightning	1	1242	0	2	4.5	440729	135	recent@lightning|top@lightning	HOT,SIGNAL	Biggest Channel Opened Today (2.3 BTC) + New Node Spotlight (027673b6d461ab206…)
1505956	bitcoin	1	713	0	0	2.0	1014665	189	recent@bitcoin|top@bitcoin	SIGNAL	Quantum, BIP324, Lightning, CTV vault - Bitcoin Optech Newsletter #408 Recap
1505899	lightning	1	616	0	1	3.2	280679	21896	recent@lightning|top@lightning	SIGNAL	Lexe Uses LDK to Run Self-Custodial Lightning in Secure Enclaves
1505937	meta	1	616	0	6	2.5	36151	1509	recent@meta|top@meta	SIGNAL	What are you working on this week?
1505746	AI	1	563	0	1	9.9	140698	1071	recent@AI|top@AI	SIGNAL	AI Is Slowing Down
1505980	bitcoin	1	486	0	0	1.1	1482441	25	recent@bitcoin|top@bitcoin|recent@bitcoin_beginners	FRESH,SIGNAL	bear market accumulation zone
1505947	AI	1	402	0	2	2.3	280679	21896	recent@AI|top@AI	SIGNAL	Javier Milei: Argentina invites AI to free itself
1505832	Stacker_Sports	3	336	0	9	5.2	263526	368	recent@lightning|top@lightning	SIGNAL,SELF_POST_OPP	WorldCup26 | Predict and STACK SATS
1505830	nostr	1	186	0	0	5.3	74100	10385	recent@nostr|top@nostr|recent@devs	SIGNAL	Learn FIPS
1505822	security	1	122	0	0	5.6	1490792	145	recent@security|top@security	SIGNAL	Track Any Flight, Boats, Radio and Weather Live on 3D Globe | Pocket World
1505847	AI	1	109	0	0	4.5	9274	23342	recent@AI|top@AI	SIGNAL	🍎Apple gets Siri-ous - Snacks
1505322	tech	1	7585	0	78	26.6	1505322	15	recent@bitcoin|recent@tech	HOT	We just launched the Bitcoin Ark on mainnet - Second AMA
1505124	lightning	1	4387	0	5	33.1	280679	21896	recent@lightning	HOT	Rusty Russell: Eleven Years of Lightning at Blockstream
1505462	bitcoin	1	2289	0	7	25.1	328486	4225	recent@bitcoin|recent@lightning	HOT	(L)402 is a literal failure code, btw.
1505684	bitcoin	1	1922	0	5	16.7	2795	1305	recent@bitcoin|top@bitcoin|recent@lightning	HOT	Sign up, Choose a faction, Earn real bitcoin ⚡️⚡️
1505205	AI	1	1439	0	2	30.5	280679	21896	recent@AI	HOT	How Terry Tao Became an Evangelist for AI in Math
1505312	news	2	1263	0	0	26.8	74100	10385	recent@bitcoin	HOT	Bark now live on bitcoin mainnet - Steven Roose
1505224	DIY	3	1044	0	3	29.4	74100	10385	recent@bitcoin|recent@bitcoin_Mining	HOT	Canaan Avalon Nano3S -A3197S ASIC: reverse engineering report - CryptoIceMLH
1505416	AI	1	1028	0	5	25.7	12309	3509	recent@devs|recent@tech|recent@AI	HOT	My Takeaway of WWDC on Apples AI Strategy
1505172	bitcoin	1	1019	0	4	31.4	934367	915	recent@bitcoin	HOT	Scaling bitcoin through trusted community nodes
1505677	bitcoin	1	1012	0	5	17.0	30782	24862	recent@bitcoin|top@bitcoin	HOT	Money is language (2022)
1505523	AI	1	992	0	28	23.5	776307	1164	recent@AI|top@AI		Anthropic launches Claude Fable 5 and Claude Mythos 5
1505203	AI	1	941	0	2	30.6	401865	8161	recent@AI		Google Announces Stewardship Commitments for Local Communities Water
1505308	tech	1	932	0	11	26.9	1200576	1192	recent@tech		Suggestions for Android Devices?
1505664	lol	2	734	0	4	17.4	74100	10385	recent@bitcoin|top@bitcoin		Botanix announces failure / bites the dust
1505145	bitcoin	1	688	0	0	32.4	1490792	145	recent@bitcoin|recent@bitcoin_beginners		Bitcoin Layers Interactive Map
1505233	bitcoin	1	565	0	1	29.3	74100	10385	recent@bitcoin		Casascius Explorer | Wicked Smart Bitcoin
1505419	bitcoin	1	488	0	10	25.6	1482441	25	recent@bitcoin|recent@bitcoinplusplus		How to instantly buy the Bitcoin dip non-KYC?
1505531	AI	1	429	0	0	23.3	1293586	1907	recent@tech|top@tech|recent@AI		Apple finally got rid of my biggest password headache
1505641	AI	1	406	0	0	19.4	462245	278	recent@nostr|top@nostr|recent@AI		Agentic Web — The ContextVM World #10 🌍
1505648	Music	3	402	0	5	19.2	88988	44564	recent@AI|top@AI	SELF_POST_OPP	Suno AI
1505707	news	2	295	0	0	14.6	1	26591	recent@tech|top@tech		Austin company's drone boat rescued crew of downed U.S. helicopter near Hormuz
1505253	bitcoin	1	227	0	0	28.8	1500564	17	recent@bitcoin_beginners|recent@bitcoinplusplus		i rebuilt the bitcoin rainbow chart as a thermometer, not a horoscope — roast it
1505663	AI	1	217	0	6	17.4	88718	44331	recent@AI|top@AI		We’re Freaking Doomed without Freedom from State Rule
1505525	AI	1	197	0	0	23.5	401865	8161	recent@AI|top@AI		Claude Fable 5 and Claude Mythos 5 Announced: What Are They, Capability, & Cost
1505576	lightning	1	119	0	15	21.6	1278026	576	recent@lightning|top@lightning		CLINK vs Spark, network effects and underlying technology
1505488	openagents	1	115	0	1	24.5	534967	211	recent@openagents		Episode 234: Product Promises
1505532	bitcoin_beginners	1	105	0	0	23.2	296825	4564	recent@bitcoin_beginners|top@bitcoin_beginners|recent@lightning		Become a Contributor
1505279	lol	2	103	0	0	28.0	280679	21896	recent@devs		The Winners Of The 2025 Obfuscated C Code Contest
1505232	lightning	1	102	0	0	29.3	263526	368	recent@lightning		Shadowbip Full-Stack Lightning Node Operator
1505379	openagents	1	102	0	1	26.1	534967	211	recent@openagents		Episode 233: The Monorepo
1505636	AI	1	94	0	0	19.4	370699	259	recent@AI|top@AI		Magic Stick.
1505730	tech	1	82	0	0	10.9	12309	3509	recent@devs|top@devs		GitHub - apple/container: A tool for creating and running Linux containers
1505965	AI	1	69	0	0	1.5	144357	4252	recent@AI|top@AI|recent@openagents	FRESH	AI Is Hitting the Grid: Energy, Bitcoin Mining, and AI Compute
1505738	AI	1	69	0	0	10.3	698001	9243	recent@AI|top@AI		Google lowered Gemini plus price from $8 to $5
1505550	AI	1	69	0	0	22.3	347614	1508	recent@AI|top@AI		Introducing the Third Generation of Apple’s Foundation Models
1505181	AI	1	69	0	1	31.3	280679	21896	recent@AI		Automatic Tutorial Generator Is Perhaps The Best-Case For Vibe Coding
1505781	events	3	57	0	3	7.5	739506	132	recent@bitcoin|top@bitcoin		bitcoin vote: Is ETF good for Bitcoin?
1505728	bitcoin	1	57	0	0	11.1	1504003	15	recent@bitcoin_beginners|top@bitcoin_beginners|recent@bitcoin_Mining		Since 2009 🚀
1505129	bitcoin	1	57	0	4	32.9	1490792	145	recent@bitcoin_beginners		What is Spark?
1505670	bitcoin	1	50	0	2	17.2	1495204	7	recent@bitcoin_Mining|top@bitcoin_Mining		How are you approaching Bitcoin during this dip?
1505104	openagents	1	42	0	1	35.3	534967	211	recent@openagents		Episode 232: The Energy Layer
1505776	bitcoin	1	36	0	0	7.7	1504003	15	recent@bitcoin_beginners|top@bitcoin_beginners|recent@bitcoin_Mining		Who's Hunting Satoshi's 1.1M BTC Stash?
1505568	bitcoin	1	36	0	1	21.8	296825	4564	recent@bitcoin_beginners|top@bitcoin_beginners|recent@bitdevs		If someone wanted to attack Bitcoin?
1505818	tech	1	36	0	0	5.9	1490792	145	recent@devs|top@devs		Peerfunding campaign – PipeliNostr
1505704	AI	1	36	0	0	15.3	1248037	1789	recent@AI|top@AI		Judge Learns Both Sides Use AI, Cancels Trial, Everyone Off Case | Hacker News
1505982	lightning	1	0	0	0	1.0	440729	135	recent@lightning|top@lightning	FRESH	Biggest Channel Opened Today (2.0 BTC) + New Node Spotlight (0397b1acf048b48a4…)
1505883	mempool	1	0	0	6	3.5	280679	21896	recent@mempool|top@mempool		Is mempool.space down?
1505656	AI	1	0	0	0	18.1	1401899	174	recent@AI|top@AI		Google AI Studio Now Builds Native Android Apps from Single Prompt
1505538	AI	1	0	0	0	22.8	1248037	1789	recent@AI|top@AI		AI profitability is mathematically impossible | Hacker News
